{
  "schemaVersion": "1.0.0",
  "registryVersion": "1.0.0",
  "effectiveAt": "2026-07-03T18:00:00Z",
  "entries": [
    {
      "id": "primitive-owner-official",
      "term": "Owner",
      "aliases": ["Accountable owner", "Process owner"],
      "primitiveType": "actor",
      "meaningStatus": "official",
      "definition": "The named role accountable for the outcome and for resolving exceptions; not necessarily the person or agent currently performing the activity.",
      "scope": "Agent and human work process",
      "owner": "Process governance lead",
      "sourceRef": "fixture://policy/process-ownership-v1",
      "version": "1.0.0",
      "effectiveFrom": "2026-07-03T00:00:00Z",
      "effectiveTo": null,
      "examples": ["The exception owner must ensure the work item reaches a resolved state."],
      "counterexamples": ["The person or agent temporarily assigned a queue item is automatically the accountable owner."],
      "relatedTerms": ["Approver", "Assignee", "Exception"],
      "validationRules": ["Every confirmed exception path must have one accountable owner."],
      "consumers": ["Flowsensa", "Mnemosync"]
    },
    {
      "id": "primitive-approved-official",
      "term": "Approved",
      "aliases": ["Authorized"],
      "primitiveType": "state",
      "meaningStatus": "official",
      "definition": "An authorized actor selected the approval path using the required evidence and within their confirmed authority.",
      "scope": "Agent and human work process",
      "owner": "Process policy owner",
      "sourceRef": "fixture://policy/approval-v1",
      "version": "1.0.0",
      "effectiveFrom": "2026-07-03T00:00:00Z",
      "effectiveTo": null,
      "examples": ["An accountable owner approved the validated work item and the decision record cites the policy."],
      "counterexamples": [
        "The work item passed automated validation, therefore it is approved.",
        "An assisting agent recommended approval, therefore it is approved."
      ],
      "relatedTerms": ["Validated", "Authority", "Evidence"],
      "validationRules": ["Approval requires a deciding authority, selected path, and evidence reference."],
      "consumers": ["Flowsensa", "Mnemosync"]
    },
    {
      "id": "primitive-complete-operational",
      "term": "Complete",
      "aliases": ["Done", "Closed"],
      "primitiveType": "outcome",
      "meaningStatus": "operational",
      "definition": "The process reached its expected end state and the acceptance evidence was recorded. Activity completion alone is insufficient.",
      "scope": "Agent and human work process",
      "owner": "Operations lead",
      "sourceRef": "fixture://runbook/completion-v1",
      "version": "1.0.0",
      "effectiveFrom": "2026-07-03T00:00:00Z",
      "effectiveTo": null,
      "examples": ["The approved work item was executed and an acceptance receipt exists."],
      "counterexamples": [
        "The execution step returned before a receipt was recorded.",
        "The final assigned task was marked done."
      ],
      "relatedTerms": ["Accepted outcome", "Evidence", "Executed"],
      "validationRules": ["A completed case must contain at least one acceptedOutcome event."],
      "consumers": ["Flowsensa", "Mnemosync"],
      "notes": "This operational definition may differ from a project-management system's generic done state."
    },
    {
      "id": "primitive-exception-official",
      "term": "Exception",
      "aliases": ["Out-of-path item"],
      "primitiveType": "exception",
      "meaningStatus": "official",
      "definition": "A case state or event that cannot proceed through the confirmed expected path without additional information, authority, correction, or handling.",
      "scope": "Agent and human work process",
      "owner": "Controls lead",
      "sourceRef": "fixture://control/exception-handling-v1",
      "version": "1.0.0",
      "effectiveFrom": "2026-07-03T00:00:00Z",
      "effectiveTo": null,
      "examples": ["A work item cannot be validated and the case enters a named resolution path."],
      "counterexamples": [
        "Any slow case is automatically an exception.",
        "A model expressed low confidence but all deterministic validations passed."
      ],
      "relatedTerms": ["Owner", "Resolution path", "Escalation"],
      "validationRules": ["Every confirmed exception requires a reason code, owner, and resolution or escalation path."],
      "consumers": ["Flowsensa", "Mnemosync"]
    },
    {
      "id": "primitive-approved-contested",
      "term": "Approved",
      "aliases": ["Ready to execute"],
      "primitiveType": "state",
      "meaningStatus": "contested",
      "definition": "One operations team informally uses approved to mean validation passed and the item is ready for human approval.",
      "scope": "Legacy operations vocabulary",
      "owner": "Vocabulary review group",
      "sourceRef": "fixture://meeting/terminology-review-2026-07-03",
      "version": "0.1.0",
      "effectiveFrom": "2026-07-03T00:00:00Z",
      "effectiveTo": null,
      "examples": ["The queue label displays approved before an authorized decision exists."],
      "counterexamples": ["Treating the legacy label as sufficient authorization."],
      "relatedTerms": ["Validated", "Official Approved"],
      "validationRules": ["Contested meaning must never satisfy the official approval control."],
      "consumers": ["Flowsensa"],
      "notes": "Included to test that the UI exposes semantic conflict rather than silently choosing one definition."
    }
  ]
}
